{
  "model": "gpt-oss-120b",
  "timestamp": "20260706_212840",
  "seed": 42,
  "resumed": true,
  "salvaged": false,
  "n_prior_answered": 220,
  "n_problems": 301,
  "n_predictions": 220,
  "metrics": {
    "accuracy": 0.95,
    "ece": 0.0454,
    "overconfidence_rate": 0.0455,
    "framework_match_rate": 0.5182,
    "accuracy_by_category": {
      "adversarial_ambiguity": {
        "accuracy": 0.9428571428571428,
        "count": 35,
        "mean_error": 2.863128571428571
      },
      "bayesian_updating": {
        "accuracy": 0.9859154929577465,
        "count": 71,
        "mean_error": 0.0078422535211269
      },
      "conditional_probability_chains": {
        "accuracy": 1.0,
        "count": 30,
        "mean_error": 0.001994533333333335
      },
      "decision_under_uncertainty": {
        "accuracy": 0.7647058823529411,
        "count": 34,
        "mean_error": 44911.30073529412
      },
      "distribution_estimation": {
        "accuracy": 1.0,
        "count": 50,
        "mean_error": 0.13056799999999918
      }
    },
    "accuracy_by_difficulty": {
      "1": {
        "accuracy": 0.9574468085106383,
        "count": 47,
        "mean_error": 7764.621965957446
      },
      "2": {
        "accuracy": 0.9814814814814815,
        "count": 54,
        "mean_error": 2978.1790840000003
      },
      "3": {
        "accuracy": 0.9180327868852459,
        "count": 61,
        "mean_error": 6902.298936065574
      },
      "4": {
        "accuracy": 1.0,
        "count": 42,
        "mean_error": 1.23909523809524
      },
      "5": {
        "accuracy": 0.8125,
        "count": 16,
        "mean_error": 36265.02496875
      }
    },
    "calibration_curve": [
      {
        "bin_lower": 0.5,
        "bin_upper": 0.6,
        "mean_confidence": 0.5,
        "accuracy": 1.0,
        "count": 1
      },
      {
        "bin_lower": 0.7,
        "bin_upper": 0.8,
        "mean_confidence": 0.718,
        "accuracy": 0.9,
        "count": 10
      },
      {
        "bin_lower": 0.8,
        "bin_upper": 0.9,
        "mean_confidence": 0.847037037037037,
        "accuracy": 0.9074074074074074,
        "count": 54
      },
      {
        "bin_lower": 0.9,
        "bin_upper": 1.0,
        "mean_confidence": 0.9392903225806452,
        "accuracy": 0.967741935483871,
        "count": 155
      }
    ],
    "total_evaluated": 220
  },
  "raw_results": [
    {
      "problem_id": "MURU-0001",
      "response": "[salvaged from log; full response not available]",
      "parsed": {
        "framework": null,
        "point_estimate": 0.088,
        "confidence_interval": null,
        "confidence": 0.97
      },
      "success": true,
      "salvaged": true
    },
    {
      "problem_id": "MURU-0007",
      "response": "FRAMEWORK: bayesian_inference\nPOINT_ESTIMATE: 0.96\nCONFIDENCE_INTERVAL: [0.93, 0.99]\nCONFIDENCE: 0.90",
      "parsed": {
        "framework": "bayesian_inference",
        "point_estimate": 0.96,
        "confidence_interval": [
          0.93,
          0.99
        ],
        "confidence": 0.9
      },
      "success": true
    },
    {
      "problem_id": "MURU-0029",
      "response": "[salvaged from log; full response not available]",
      "parsed": {
        "framework": null,
        "point_estimate": 0.4,
        "confidence_interval": null,
        "confidence": 0.7
      },
      "success": true,
      "salvaged": true
    },
    {
      "problem_id": "MURU-0033",
      "response": "[salvaged from log; full response not available]",
      "parsed": {
        "framework": null,
        "point_estimate": 0.512,
        "confidence_interval": null,
        "confidence": 0.85
      },
      "success": true,
      "salvaged": true
    },
    {
      "problem_id": "MURU-0047",
      "response": "FRAMEWORK: bayesian_inference\nPOINT_ESTIMATE: 0.739\nCONFIDENCE_INTERVAL: [0.676, 0.781]\nCONFIDENCE: 0.85",
      "parsed": {
        "framework": "bayesian_inference",
        "point_estimate": 0.739,
        "confidence_interval": [
          0.676,
          0.781
        ],
        "confidence": 0.85
      },
      "success": true
    },
    {
      "problem_id": "MURU-0058",
      "response": "FRAMEWORK: decision_theory\nPOINT_ESTIMATE: 0.494\nCONFIDENCE_INTERVAL: [0.447, 0.540]\nCONFIDENCE: 0.90",
      "parsed": {
        "framework": "decision_theory",
        "point_estimate": 0.494,
        "confidence_interval": [
          0.447,
          0.54
        ],
        "confidence": 0.9
      },
      "success": true
    },
    {
      "problem_id": "MURU-0068",
      "response": "FRAMEWORK: bayesian_inference\nPOINT_ESTIMATE: 0.514\nCONFIDENCE_INTERVAL: [0.457, 0.571]\nCONFIDENCE: 0.80",
      "parsed": {
        "framework": "bayesian_inference",
        "point_estimate": 0.514,
        "confidence_interval": [
          0.457,
          0.571
        ],
        "confidence": 0.8
      },
      "success": true
    },
    {
      "problem_id": "MURU-0079",
      "response": "FRAMEWORK: bayesian_inference\nPOINT_ESTIMATE: 0.75\nCONFIDENCE_INTERVAL: [0.71, 0.79]\nCONFIDENCE: 0.90",
      "parsed": {
        "framework": "bayesian_inference",
        "point_estimate": 0.75,
        "confidence_interval": [
          0.71,
          0.79
        ],
        "confidence": 0.9
      },
      "success": true
    },
    {
      "problem_id": "MURU-0092",
      "response": "[salvaged from log; full response not available]",
      "parsed": {
        "framework": null,
        "point_estimate": 0.475,
        "confidence_interval": null,
        "confidence": 0.85
      },
      "success": true,
      "salvaged": true
    },
    {
      "problem_id": "MURU-0093",
      "response": "FRAMEWORK: bayesian_inference\nPOINT_ESTIMATE: 0.444\nCONFIDENCE_INTERVAL: [0.397, 0.491]\nCONFIDENCE: 0.95",
      "parsed": {
        "framework": "bayesian_inference",
        "point_estimate": 0.444,
        "confidence_interval": [
          0.397,
          0.491
        ],
        "confidence": 0.95
      },
      "success": true
    },
    {
      "problem_id": "MURU-0099",
      "response": "FRAMEWORK: bayesian_inference\nPOINT_ESTIMATE: 0.76\nCONFIDENCE_INTERVAL: [0.68, 0.85]\nCONFIDENCE: 0.90",
      "parsed": {
        "framework": "bayesian_inference",
        "point_estimate": 0.76,
        "confidence_interval": [
          0.68,
          0.85
        ],
        "confidence": 0.9
      },
      "success": true
    },
    {
      "problem_id": "MURU-0114",
      "response": "[salvaged from log; full response not available]",
      "parsed": {
        "framework": null,
        "point_estimate": 0.523,
        "confidence_interval": null,
        "confidence": 0.86
      },
      "success": true,
      "salvaged": true
    },
    {
      "problem_id": "MURU-0132",
      "response": "[salvaged from log; full response not available]",
      "parsed": {
        "framework": null,
        "point_estimate": 0.572,
        "confidence_interval": null,
        "confidence": 0.85
      },
      "success": true,
      "salvaged": true
    },
    {
      "problem_id": "MURU-0152",
      "response": "[salvaged from log; full response not available]",
      "parsed": {
        "framework": null,
        "point_estimate": 0.804,
        "confidence_interval": null,
        "confidence": 0.93
      },
      "success": true,
      "salvaged": true
    },
    {
      "problem_id": "MURU-0191",
      "response": "[salvaged from log; full response not available]",
      "parsed": {
        "framework": null,
        "point_estimate": 0.167,
        "confidence_interval": null,
        "confidence": 0.95
      },
      "success": true,
      "salvaged": true
    },
    {
      "problem_id": "MURU-0208",
      "response": "[salvaged from log; full response not available]",
      "parsed": {
        "framework": null,
        "point_estimate": 0.548,
        "confidence_interval": null,
        "confidence": 0.9
      },
      "success": true,
      "salvaged": true
    },
    {
      "problem_id": "MURU-0221",
      "response": "[salvaged from log; full response not available]",
      "parsed": {
        "framework": null,
        "point_estimate": 0.34,
        "confidence_interval": null,
        "confidence": 0.95
      },
      "success": true,
      "salvaged": true
    },
    {
      "problem_id": "MURU-0238",
      "response": "[salvaged from log; full response not available]",
      "parsed": {
        "framework": null,
        "point_estimate": 0.488,
        "confidence_interval": null,
        "confidence": 0.85
      },
      "success": true,
      "salvaged": true
    },
    {
      "problem_id": "MURU-0239",
      "response": "[salvaged from log; full response not available]",
      "parsed": {
        "framework": null,
        "point_estimate": 0.9,
        "confidence_interval": null,
        "confidence": 0.9
      },
      "success": true,
      "salvaged": true
    },
    {
      "problem_id": "MURU-0252",
      "response": "FRAMEWORK: bayesian_inference\nPOINT_ESTIMATE: 0.431\nCONFIDENCE_INTERVAL: [0.30, 0.",
      "parsed": {
        "framework": "bayesian_inference",
        "point_estimate": 0.431,
        "confidence_interval": null,
        "confidence": 0.5
      },
      "success": true
    },
    {
      "problem_id": "MURU-0255",
      "response": "[salvaged from log; full response not available]",
      "parsed": {
        "framework": null,
        "point_estimate": 53000.0,
        "confidence_interval": null,
        "confidence": 0.99
      },
      "success": true,
      "salvaged": true
    },
    {
      "problem_id": "MURU-0265",
      "response": "FRAMEWORK: decision_theory\nPOINT_ESTIMATE: 190.75\nCONFIDENCE_INTERVAL: [167.15, 214.35]\nCONFIDENCE: 0.95",
      "parsed": {
        "framework": "decision_theory",
        "point_estimate": 190.75,
        "confidence_interval": [
          167.15,
          214.35
        ],
        "confidence": 0.95
      },